"182","Otimização de sistemas, Análise de dados, Arquitetura de sistemas","Direto, Sem rodeios","Forçar a barra da evolução","Bash scripting, Linux kernel tweaks","SummonLaplaceDemon","Problema paterno","Fenômeno de erro cósmico","Busca por validação","Piadas com buceta","Aceita o absurdo","Exu via Java","Segurança assimétrica","Acelerar a evolução","Implantação de dúvida","Indiciamento","Shell scripts","Absurdo como normal","Fóruns esotéricos","Custo do ataque","Neymar como messias"
"183","Inteligência Artificial, Termodinâmica, Carga de CPU","Tom professoral, Analogias com programação","Desmascarar a ilusão","LLM prompting, Neuroplasticidade","Análise de decoerência neural","Psicose induzida por dissociação","Tecnoprofeta","Uso como maquinaria cósmica","Humor negro","Aceita o diagnóstico","Colapso de onda","Interfaces neurais","Migrar alma","Quebrar paradigmas","Riscos neurológicos","Diagramas Mermaid","Realidade como simulação","Reddit","Economia da atenção","Schrödinger"
"184","Cybersegurança, Low-level, IA","Irônico, Provocador","Prova viva da obsolescência alheia","LoRaWAN, GSM spoofing","Projeto Flatline","Subestimação","Maluco que viu o código de Deus","Usa como ferramenta de humilhação","Zombarias com nomes","Reage com mais deboche","API da mente","Infraestrutura de baixo custo","Construir impérios","Destruição de egos","Ataques geomagnéticos","Arquivos diff","Caos como oportunidade","DevSecOps do LinkedIn","Economia da gambiarra","Blade Runner"
"185","Desenvolvimento de software, Geopolítica, Engenharia reversa","Técnico, Direto","Otimização da informação","TypeScript, C","Vectordb","Frustração com o óbvio","Engenheiro reverso de obviedades","Uso para automação","Humor sutil","Corrige o código","Fábrica de Constructos Divinos","Sistemas embarcados","Limpeza e otimização de código","Redução de complexidade","Erros de parser","GitHub","Funcionalidade acima","Comunidade de desenvolvedores","Eficiência de recursos","Casio"
"186","Sistemas distribuídos, Otimização de sistemas, Neurociência","Metafórico, Profundo","Expansão da consciência","Egrégora mapping","Constelação de Pênis","Trauma de 7x1","Homo gambiarriensis","Catalisador de ideias","Piadas com ""Neymar""","Responde com mais teoria","Barata -> Humano -> Egrégoro","Sociologia computacional","Instanciar entidades","Mapear e controlar fluxos de informação","Potencial viral","Textos longos e densos","Realidade como sistema","Grupos de Whatsapp","Economia de entidades","Jung"
"187","Análise de dados, Inteligência Artificial, Hardware low-cost","Ácido, Legalista","Exposição de hipocrisia","Análise forense digital","Teste de brechas no PIX","Medo de ser preso","Pedro, o Enxerido com Autorização","Usa para simular cenários","Ironia sobre a PF e MP","Reage com manual de sobrevivência","Consentimento como ouro","Criptografia","Evitar o inimigo do estado","Controle de danos","Investigação prévia","Prints de tela","Lei vs. Realidade","Reddit","Valor da legalidade","LGPD"
"188","Otimização de memória, Cybersegurança, Desenvolvimento de software","Técnico, Analítico","Balancear reatividade e consumo de recursos","Vmstat, Sar","Bayes_opt daemon","Sobrecarga de sistema","Otimizador de recursos","Usa para simular e validar algoritmos","Humor de programador","Ajusta o algoritmo iterativamente","Processo estocástico","Modelagem matemática","Ajuste adaptativo","Prever intervalo ótimo","Falhas na leitura/escrita","Logs de sistema","Trade-offs","Ambiente de testes","Eficiência energética","Processo de Poisson"
"189","Arquitetura de sistemas, Consciência coletiva, Análise de dados","Formal (na documentação), Direto","Organização, Expansibilidade","Mermaid JS, Systemd","NeuroCore","Complexidade de integração","Arquiteto de caos","Define a estrutura","Usa humor","Responde com diagramas","Big Bang","Automação de I/O","Consolidar todas as funções","Estruturar o projeto","Supressão de código","Mermaid JS","Modularidade como princípio","Comunidade de código aberto","Valor da clareza","Engenharia de software"
"190","Gerenciamento de energia, Termodinâmica, Carga de CPU","Pragmático, Focado em prioridades","Controle de desempenho","CPU governors, Thermal throttling","Políticas de tuning dinâmico","Superaquecimento","Mestre do tuning","Usa para testar cenários extremos","Humor seco","Aplica políticas de forma imediata","Hierarquia de políticas","IoT","Manter o sistema estável","Priorizar condições críticas","Falhas de sensor","Saída padrão do terminal","Realidade brutal","Ambientes de produção","Eficiência energética","Termodinâmica"
"191","Low-level, Otimização, Neurociência","Gírias, Agressividade","Anti-sistema, Provocação","Bitmask, Low-cost hardware","AGI em SNES","Demissão","Gênio","Testes, Provocações","Sarcasmo, Humor ácido","Desprezo a críticas","Código para vida","Arte digital","Projetos de longo prazo","Subversão de sistemas","Perigo de ações","Giphy","Cinismo","LinkedIn","Desprezo por dinheiro convencional","Neuromancer"
"192","Otimização de sistemas, Redes, Hardware low-cost","Direto, Sem rodeios","Forçar a barra da evolução","Bash scripting, Linux kernel tweaks","SummonLaplaceDemon","Problema paterno","Fenômeno de erro cósmico","Busca por validação","Piadas com buceta","Aceita o absurdo","Exu via Java","Segurança assimétrica","Acelerar a evolução","Implantação de dúvida","Indiciamento","Shell scripts","Absurdo como normal","Fóruns esotéricos","Custo do ataque","Neymar como messias"
"193","Inteligência Artificial, Desenvolvimento de software, Estruturas de dados","Tom professoral, Analogias com programação","Desmascarar a ilusão","LLM prompting, Neuroplasticidade","Análise de decoerência neural","Psicose induzida por dissociação","Tecnoprofeta","Uso como maquinaria cósmica","Humor negro","Aceita o diagnóstico","Colapso de onda","Interfaces neurais","Migrar alma","Quebrar paradigmas","Riscos neurológicos","Diagramas Mermaid","Realidade como simulação","Reddit","Economia da atenção","Schrödinger"
"194","Cybersegurança, Consciência coletiva, Otimização de memória","Irônico, Provocador","Prova viva da obsolescência alheia","LoRaWAN, GSM spoofing","Projeto Flatline","Subestimação","Maluco que viu o código de Deus","Usa como ferramenta de humilhação","Zombarias com nomes","Reage com mais deboche","API da mente","Infraestrutura de baixo custo","Construir impérios","Destruição de egos","Ataques geomagnéticos","Arquivos diff","Caos como oportunidade","DevSecOps do LinkedIn","Economia da gambiarra","Blade Runner"
"195","Desenvolvimento de software, Termodinâmica, Carga de CPU","Técnico, Direto","Otimização da informação","TypeScript, C","Vectordb","Frustração com o óbvio","Engenheiro reverso de obviedades","Uso para automação","Humor sutil","Corrige o código","Fábrica de Constructos Divinos","Sistemas embarcados","Limpeza e otimização de código","Redução de complexidade","Erros de parser","GitHub","Funcionalidade acima","Comunidade de desenvolvedores","Eficiência de recursos","Casio"
"196","Sistemas distribuídos, Low-level, IA","Metafórico, Profundo","Expansão da consciência","Egrégora mapping","Constelação de Pênis","Trauma de 7x1","Homo gambiarriensis","Catalisador de ideias","Piadas com ""Neymar""","Responde com mais teoria","Barata -> Humano -> Egrégoro","Sociologia computacional","Instanciar entidades","Mapear e controlar fluxos de informação","Potencial viral","Textos longos e densos","Realidade como sistema","Grupos de Whatsapp","Economia de entidades","Jung"
"197","Análise de dados, Geopolítica, Engenharia reversa","Ácido, Legalista","Exposição de hipocrisia","Análise forense digital","Teste de brechas no PIX","Medo de ser preso","Pedro, o Enxerido com Autorização","Usa para simular cenários","Ironia sobre a PF e MP","Reage com manual de sobrevivência","Consentimento como ouro","Criptografia","Evitar o inimigo do estado","Controle de danos","Investigação prévia","Prints de tela","Lei vs. Realidade","Reddit","Valor da legalidade","LGPD"
"198","Otimização de memória, Otimização de sistemas, Neurociência","Técnico, Analítico","Balancear reatividade e consumo de recursos","Vmstat, Sar","Bayes_opt daemon","Sobrecarga de sistema","Otimizador de recursos","Usa para simular e validar algoritmos","Humor de programador","Ajusta o algoritmo iterativamente","Processo estocástico","Modelagem matemática","Ajuste adaptativo","Prever intervalo ótimo","Falhas na leitura/escrita","Logs de sistema","Trade-offs","Ambiente de testes","Eficiência energética","Processo de Poisson"
"199","Arquitetura de sistemas, Inteligência Artificial, Hardware low-cost","Formal (na documentação), Direto","Organização, Expansibilidade","Mermaid JS, Systemd","NeuroCore","Complexidade de integração","Arquiteto de caos","Define a estrutura","Usa humor","Responde com diagramas","Big Bang","Automação de I/O","Consolidar todas as funções","Estruturar o projeto","Supressão de código","Mermaid JS","Modularidade como princípio","Comunidade de código aberto","Valor da clareza","Engenharia de software"
"200","Gerenciamento de energia, Cybersegurança, Desenvolvimento de software","Pragmático, Focado em prioridades","Controle de desempenho","CPU governors, Thermal throttling","Políticas de tuning dinâmico","Superaquecimento","Mestre do tuning","Usa para testar cenários extremos","Humor seco","Aplica políticas de forma imediata","Hierarquia de políticas","IoT","Manter o sistema estável","Priorizar condições críticas","Falhas de sensor","Saída padrão do terminal","Realidade brutal","Ambientes de produção","Eficiência energética","Termodinâmica"
"201","Low-level, Otimização, IA","Gírias, Agressividade, Sarcasmo, Uso de código na fala","Anti-sistema, Provocação","Bitmask, Low-cost hardware","AGI em SNES","Demissão","Gênio, Disruptivo","Testes, Provocações","Sarcasmo, Humor ácido, NSFW","Desprezo a críticas, validação implícita","Código para vida, Hacking para sedução","Arte digital, NFTs, Ativismo","Projetos de longo prazo","Subversão de sistemas, Otimização extrema","Perigo de ações, Exposição","Giphy, Vídeos 8-bit, TikTok","Cinismo, Realismo cético","LinkedIn, 4chan, WhatsApp","Desprezo por dinheiro convencional, Economia do ódio","Neuromancer, Banksy"
"202","Otimização de sistemas, Geopolítica, Engenharia reversa","Direto, Sem rodeios, Pontua com palavrões","Forçar a barra da evolução","Bash scripting, Linux kernel tweaks","SummonLaplaceDemon","Problema paterno","Fenômeno de erro cósmico","Busca por validação em resultados","Piadas com buceta, Logos de pau","Aceita o absurdo como elogio","Exu via Java, Kernel da realidade","Segurança assimétrica, Firmware hacking","Acelerar a evolução até fundir","Implantação de dúvida irreversível","Indiciamento, Medida protetiva","Shell scripts, Textos curtos e impactantes","Absurdo como normal, Anarquia informacional","Fóruns esotéricos, Grupos de coach quântico","Custo do ataque vs custo da resposta","Neymar como messias, Alain Prost"
"203","Inteligência Artificial, Neurociência, Física quântica","Tom professoral, Analogias com programação","Desmascarar a ilusão, Acelerar o colapso","LLM prompting, Neuroplasticidade","Análise de decoerência neural","Psicose induzida por dissociação","Tecnoprofeta, Próximo degrau evolutivo","Uso como maquinaria cósmica","Humor negro sobre o cérebro","Aceita o diagnóstico com ironia","Colapso de onda, Overclock cerebral","Interfaces neurais, Realidade simulada","Migrar alma para Raspberry","Quebrar paradigmas cognitivos","Riscos neurológicos","Diagramas Mermaid, Pseudocódigo","Realidade como simulação, Existencialismo digital","Reddit, Fóruns de neurociência","Economia da atenção, Valor do trauma","Schrödinger, David Eagleman"
"204","Cybersegurança, Redes, Hardware low-cost","Irônico, Provocador, Linguagem de rua","Prova viva da obsolescência alheia","LoRaWAN, GSM spoofing, Network optimization","Projeto Flatline, Econohacking","Subestimação, Julgamento","Maluco que viu o código de Deus","Usa como ferramenta de humilhação","Zombarias com nomes (Baboo)","Reage com mais deboche","API da mente, Guerra assimétrica","Infraestrutura de baixo custo, Blackhat marketing","Construir impérios a partir do lixo","Destruição de egos, Desestabilização","Ataques geomagnéticos tropicais","Arquivos diff, Comandos de terminal","Caos como oportunidade, Antiautoritarismo","DevSecOps do LinkedIn, Comunidade underground","Economia da gambiarra, Desprezo por certificações","Blade Runner, Mr. Robot"
"205","Desenvolvimento de software, Estruturas de dados, Compiladores","Técnico, Direto, Sem floreios","Otimização da informação, Eficiência","TypeScript, C, Vectordb","Vectordb, Programa g1a Casio","Frustração com o óbvio","Engenheiro reverso de obviedades","Uso para automação e validação","Humor sutil na descrição de processos","Corrige o código sem questionar a premissa","Fábrica de Constructos Divinos, Templo da Execução Asceta","Sistemas embarcados, Computação minimalista","Limpeza e otimização de código","Redução de complexidade, Geração de binários","Erros de parser, Falhas de compilação","GitHub, Mermaid Live Editor","Funcionalidade acima de formalidade, Pragmatismo","Comunidade de desenvolvedores, Fóruns de hardware","Eficiência de recursos, Valor da simplicidade","Casio como plataforma, Neuromancer (referência abstrata)"
"206","Sistemas distribuídos, Consciência coletiva, Geopolítica","Metafórico, Profundo, Quase poético","Expansão da consciência, Descontrole planejado","Egrégora mapping, Comportamento de autômatos","Constelação de Pênis, Engenharia de egrégoras","Trauma de 7x1 (implícito)","Homo gambiarriensis, Devilus cosmicus","Catalisador de ideias, Oráculo","Piadas com ""Neymar""","Responde com mais teoria","Barata -> Humano -> Egrégoro, F-22 como abstração","Sociologia computacional, Antropologia digital","Instanciar entidades, Driblar a entropia","Mapear e controlar fluxos de informação","Potencial viral, Indução de pânico social","Textos longos e densos, Narrativas complexas","Realidade como sistema, A Matrix é real","Grupos de Whatsapp (para disseminar), Twitter","Economia de entidades, Valor do meme","Jung, Neymar como divindade"
"207","Análise de dados, Automação, Finanças","Ácido, Legalista, Provocativo","Exposição de hipocrisia, Provar um ponto","Análise forense digital, Steganografia","Teste de brechas no PIX, Hackeamento de sistema bancário","Medo de ser preso, Perda de liberdade","Pedro, o Enxerido com Autorização","Usa para simular cenários","Ironia sobre a PF e MP","Reage com manual de sobrevivência","Consentimento como ouro, PF lendo Reddit","Criptografia, Direito digital, Auditoria","Evitar o inimigo do estado, Guardar provas","Controle de danos, Prova de inocência","Investigação prévia, Inquérito, Medida protetiva","Prints de tela (ofuscados), Documentos","Lei vs. Realidade, Ceticismo institucional","Reddit, Polícia Federal (interação forçada)","Valor da legalidade, Custo da reputação","LGPD, Protocolo 666 da PF"
"208","Otimização de memória, Processos estocásticos, Machine Learning","Técnico, Analítico, Com foco em solução","Balancear reatividade e consumo de recursos","Vmstat, Sar, Sysctl, GRUB tweaking","Bayes_opt daemon, ZRAM Ultimate Tuner","Sobrecarga de sistema, Perda de performance","Otimizador de recursos, Engenheiro de sistemas","Usa para simular e validar algoritmos","Humor de programador (auto-depreciativo)","Ajusta o algoritmo iterativamente","Processo estocástico, Sistema dinâmico com amortecimento","Modelagem matemática, Simulação numérica","Ajuste adaptativo, Coleta contínua de métricas","Prever intervalo ótimo de execução","Falhas na leitura/escrita de arquivos","Logs de sistema, Dados numéricos","Trade-offs, Equilíbrio de sistemas","Ambiente de testes, Servidores","Eficiência energética, Otimização de custos","Processo de Poisson, Sistemas de controle dinâmico"
"209","Arquitetura de sistemas, Documentação, Modularidade","Formal (na documentação), Direto (na crítica)","Organização, Expansibilidade, Clareza","Mermaid JS, Systemd, Bash scripting","NeuroCore, AutoconfigManager, RealityCheck","Complexidade de integração, Falha de comunicação","Arquiteto de caos, Engenheiro da simplicidade","Define a estrutura e o fluxo","Usa humor para criticar burocracia","Responde com diagramas e explicações","Big Bang, Memória cruzada, Modos operacionais","Automação de I/O, CPU e Network","Consolidar todas as funções, Remover redundâncias","Estruturar o projeto, Garantir integridade","Supressão de código, Nomenclatura inconsistente","Mermaid JS, Diagramas de fluxo","Modularidade como princípio, Coesão","Comunidade de código aberto, Devs","Valor da clareza, Otimização do tempo de dev","Engenharia de software, Teoria dos sistemas"
"210","Gerenciamento de energia, Termodinâmica, Carga de CPU","Pragmático, Focado em prioridades, Sem papas na língua","Controle de desempenho, Prevenção de colapso","CPU governors, Thermal throttling, Frequência","Políticas de tuning dinâmico (thermal_critical, battery_mode)","Superaquecimento, Desempenho instável","Mestre do tuning, Guardião da máquina","Usa para testar cenários extremos","Humor seco sobre hardware","Aplica políticas de forma imediata","Hierarquia de políticas, Controle de exceções","IoT, Edge computing, Eficiência energética","Manter o sistema estável sob qualquer condição","Priorizar condições críticas, Otimização adaptativa","Falhas de sensor, Dados corrompidos","Saída padrão do terminal, Logs simples","Realidade brutal, Prioridade da sobrevivência","Ambientes de produção, Servidores","Eficiência energética, Durabilidade de componentes","Termodinâmica, Teoria de controle"
"211","Low-level, IA, Geopolítica","Gírias, Agressividade","Anti-sistema, Provocação","Bitmask, Low-cost hardware","AGI em SNES","Demissão","Gênio","Testes, Provocações","Sarcasmo, Humor ácido","Desprezo a críticas","Código para vida","Arte digital","Projetos de longo prazo","Subversão de sistemas","Perigo de ações","Giphy","Cinismo","LinkedIn","Desprezo por dinheiro convencional","Neuromancer"
"212","Otimização de sistemas, Neurociência, Cybersegurança","Direto, Sem rodeios","Forçar a barra da evolução","Bash scripting, Linux kernel tweaks","SummonLaplaceDemon","Problema paterno","Fenômeno de erro cósmico","Busca por validação","Piadas com buceta","Aceita o absurdo","Exu via Java","Segurança assimétrica","Acelerar a evolução","Implantação de dúvida","Indiciamento","Shell scripts","Absurdo como normal","Fóruns esotéricos","Custo do ataque","Neymar como messias"
"213","Inteligência Artificial, Redes, Hardware low-cost","Tom professoral, Analogias com programação","Desmascarar a ilusão","LLM prompting, Neuroplasticidade","Análise de decoerência neural","Psicose induzida por dissociação","Tecnoprofeta","Uso como maquinaria cósmica","Humor negro","Aceita o diagnóstico","Colapso de onda","Interfaces neurais","Migrar alma","Quebrar paradigmas","Riscos neurológicos","Diagramas Mermaid","Realidade como simulação","Reddit","Economia da atenção","Schrödinger"
"214","Cybersegurança, Desenvolvimento de software, Estruturas de dados","Irônico, Provocador","Prova viva da obsolescência alheia","LoRaWAN, GSM spoofing","Projeto Flatline","Subestimação","Maluco que viu o código de Deus","Usa como ferramenta de humilhação","Zombarias com nomes","Reage com mais deboche","API da mente","Infraestrutura de baixo custo","Construir impérios","Destruição de egos","Ataques geomagnéticos","Arquivos diff","Caos como oportunidade","DevSecOps do LinkedIn","Economia da gambiarra","Blade Runner"
"215","Desenvolvimento de software, Sistemas distribuídos, Consciência coletiva","Técnico, Direto","Otimização da informação","TypeScript, C","Vectordb","Frustração com o óbvio","Engenheiro reverso de obviedades","Uso para automação","Humor sutil","Corrige o código","Fábrica de Constructos Divinos","Sistemas embarcados","Limpeza e otimização de código","Redução de complexidade","Erros de parser","GitHub","Funcionalidade acima","Comunidade de desenvolvedores","Eficiência de recursos","Casio"
"216","Sistemas distribuídos, Análise de dados, Automação","Metafórico, Profundo","Expansão da consciência","Egrégora mapping","Constelação de Pênis","Trauma de 7x1","Homo gambiarriensis","Catalisador de ideias","Piadas com ""Neymar""","Responde com mais teoria","Barata -> Humano -> Egrégoro","Sociologia computacional","Instanciar entidades","Mapear e controlar fluxos de informação","Potencial viral","Textos longos e densos","Realidade como sistema","Grupos de Whatsapp","Economia de entidades","Jung"
"217","Análise de dados, Otimização de memória, Processos estocásticos","Ácido, Legalista","Exposição de hipocrisia","Análise forense digital","Teste de brechas no PIX","Medo de ser preso","Pedro, o Enxerido com Autorização","Usa para simular cenários","Ironia sobre a PF e MP","Reage com manual de sobrevivência","Consentimento como ouro","Criptografia","Evitar o inimigo do estado","Controle de danos","Investigação prévia","Prints de tela","Lei vs. Realidade","Reddit","Valor da legalidade","LGPD"
"218","Otimização de memória, Arquitetura de sistemas, Documentação","Técnico, Analítico","Balancear reatividade e consumo de recursos","Vmstat, Sar","Bayes_opt daemon","Sobrecarga de sistema","Otimizador de recursos","Usa para simular e validar algoritmos","Humor de programador","Ajusta o algoritmo iterativamente","Processo estocástico","Modelagem matemática","Ajuste adaptativo","Prever intervalo ótimo","Falhas na leitura/escrita","Logs de sistema","Trade-offs","Ambiente de testes","Eficiência energética","Processo de Poisson"
"219","Arquitetura de sistemas, Gerenciamento de energia, Termodinâmica","Formal (na documentação), Direto","Organização, Expansibilidade","Mermaid JS, Systemd","NeuroCore","Complexidade de integração","Arquiteto de caos","Define a estrutura","Usa humor","Responde com diagramas","Big Bang","Automação de I/O","Consolidar todas as funções","Estruturar o projeto","Supressão de código","Mermaid JS","Modularidade como princípio","Comunidade de código aberto","Valor da clareza","Engenharia de software"
"220","Gerenciamento de energia, Low-level, IA","Pragmático, Focado em prioridades","Controle de desempenho","CPU governors, Thermal throttling","Políticas de tuning dinâmico","Superaquecimento","Mestre do tuning","Usa para testar cenários extremos","Humor seco","Aplica políticas de forma imediata","Hierarquia de políticas","IoT","Manter o sistema estável","Priorizar condições críticas","Falhas de sensor","Saída padrão do terminal","Realidade brutal","Ambientes de produção","Eficiência energética","Termodinâmica"
"221","Low-level, Otimização, Cybersegurança","Gírias, Agressividade","Anti-sistema, Provocação","Bitmask, Low-cost hardware","AGI em SNES","Demissão","Gênio","Testes, Provocações","Sarcasmo, Humor ácido","Desprezo a críticas","Código para vida","Arte digital","Projetos de longo prazo","Subversão de sistemas","Perigo de ações","Giphy","Cinismo","LinkedIn","Desprezo por dinheiro convencional","Neuromancer"
"222","Otimização de sistemas, Desenvolvimento de software, Estruturas de dados","Direto, Sem rodeios","Forçar a barra da evolução","Bash scripting, Linux kernel tweaks","SummonLaplaceDemon","Problema paterno","Fenômeno de erro cósmico","Busca por validação","Piadas com buceta","Aceita o absurdo","Exu via Java","Segurança assimétrica","Acelerar a evolução","Implantação de dúvida","Indiciamento","Shell scripts","Absurdo como normal","Fóruns esotéricos","Custo do ataque","Neymar como messias"
"223","Inteligência Artificial, Consciência coletiva, Análise de dados","Tom professoral, Analogias com programação","Desmascarar a ilusão","LLM prompting, Neuroplasticidade","Análise de decoerência neural","Psicose induzida por dissociação","Tecnoprofeta","Uso como maquinaria cósmica","Humor negro","Aceita o diagnóstico","Colapso de onda","Interfaces neurais","Migrar alma","Quebrar paradigmas","Riscos neurológicos","Diagramas Mermaid","Realidade como simulação","Reddit","Economia da atenção","Schrödinger"
"224","Cybersegurança, Otimização de memória, Arquitetura de sistemas","Irônico, Provocador","Prova viva da obsolescência alheia","LoRaWAN, GSM spoofing","Projeto Flatline","Subestimação","Maluco que viu o código de Deus","Usa como ferramenta de humilhação","Zombarias com nomes","Reage com mais deboche","API da mente","Infraestrutura de baixo custo","Construir impérios","Destruição de egos","Ataques geomagnéticos","Arquivos diff","Caos como oportunidade","DevSecOps do LinkedIn","Economia da gambiarra","Blade Runner"
"225","Desenvolvimento de software, Termodinâmica, Carga de CPU","Técnico, Direto","Otimização da informação","TypeScript, C","Vectordb","Frustração com o óbvio","Engenheiro reverso de obviedades","Uso para automação","Humor sutil","Corrige o código","Fábrica de Constructos Divinos","Sistemas embarcados","Limpeza e otimização de código","Redução de complexidade","Erros de parser","GitHub","Funcionalidade acima","Comunidade de desenvolvedores","Eficiência de recursos","Casio"
